domain,dataset_name,link,source
competition,2021 Amazon Last Mile Routing Research Challenge Dataset,https://registry.opendata.aws/amazon-last-mile-challenges/,aws_open_data
competition,AI2 Reasoning Challenge (ARC) 2018,https://registry.opendata.aws/allenai-arc/,aws_open_data
competition,Allen Institute for Neural Dynamics - Extracellular Electrophysiology Compression Benchmark,https://registry.opendata.aws/allen-nd-ephys-compression/,aws_open_data
competition,Astrophysics Division Galaxy Morphology Benchmark Dataset,https://registry.opendata.aws/apd_galaxymorph/,aws_open_data
competition,Astrophysics Division Galaxy Segmentation Benchmark Dataset,https://registry.opendata.aws/apd_galaxysegmentation/,aws_open_data
competition,Biological and Physical Sciences (BPS) Microscopy Benchmark Training Dataset,https://registry.opendata.aws/bps_microscopy/,aws_open_data
competition,Biological and Physical Sciences (BPS) RNA Sequencing Benchmark Training Dataset,https://registry.opendata.aws/bps_rnaseq/,aws_open_data
competition,DialoGLUE: A Natural Language Understanding Benchmark for Task-Oriented Dialogue,https://registry.opendata.aws/dialoglue/,aws_open_data
competition,Garvan Institute Long Read Sequencing Benchmark Data,https://registry.opendata.aws/gtgseq/,aws_open_data
competition,KITTI Vision Benchmark Suite,https://registry.opendata.aws/kitti/,aws_open_data
competition,LEarning bi Ochemical Prostate c Ancer Recurrence from histopathology sli Des challenge (LEOPARD) Dataset,https://registry.opendata.aws/leopard/,aws_open_data
competition,NASA SOHO/LASCO2 comet challenge on AWS,https://registry.opendata.aws/nasa-soho-comet-challenge-on-aws/,aws_open_data
competition,Oxford Nanopore Technologies Benchmark Datasets,https://registry.opendata.aws/ont-open-data/,aws_open_data
competition,Vesuvius Challenge - CT Scans of Herculaneum Papyri,https://registry.opendata.aws/vesuvius-challenge-herculaneum-scrolls/,aws_open_data
competition,Will Two Do? Varying Dimensions in Electrocardiography: The Physio Net/Computing in Cardiology Challenge 2021,https://registry.opendata.aws/challenge-2021/,aws_open_data
competition,A 6-figure prize by soccer prediction,https://www.kaggle.com/datasets/analystmasters/earn-your-6-figure-prize,kaggle
competition,Adience Benchmark Gender And Age Classification,https://www.kaggle.com/datasets/ttungl/adience-benchmark-gender-and-age-classification,kaggle
competition,Amex Competition Data in Parquet Format,https://www.kaggle.com/datasets/odins0n/amex-parquet,kaggle
competition,Browse Comp: A Benchmark for Browsing Agents,https://www.kaggle.com/datasets/openai/browsecomp-a-benchmark-for-browsing-agents,kaggle
competition,Car Price Prediction Challenge,https://www.kaggle.com/datasets/deepcontractor/car-price-prediction-challenge,kaggle
competition,Caravan Insurance Challenge,https://www.kaggle.com/datasets/uciml/caravan-insurance-challenge,kaggle
competition,COVID-19 Open Research Dataset Challenge (CORD-19),https://www.kaggle.com/datasets/allen-institute-for-ai/CORD-19-research-challenge,kaggle
competition,End ALS Kaggle Challenge,https://www.kaggle.com/datasets/alsgroup/end-als,kaggle
competition,FIFA - Football World Cup Dataset,https://www.kaggle.com/datasets/iamsouravbanerjee/fifa-football-world-cup-dataset,kaggle
competition,FIFA World Cup,https://www.kaggle.com/datasets/abecklas/fifa-world-cup,kaggle
competition,FIFA World Cup 2022,https://www.kaggle.com/datasets/brenda89/fifa-world-cup-2022,kaggle
competition,Fifa World Cup 2022: Complete Dataset,https://www.kaggle.com/datasets/die9origephit/fifa-world-cup-2022-complete-dataset,kaggle
competition,FIFA World Cup All Dataset,https://www.kaggle.com/datasets/abhijitdahatonde/fifa-world-cup-all-dataset,kaggle
competition,"Football - FIFA World Cup, 1930 - 2022",https://www.kaggle.com/datasets/piterfm/fifa-football-world-cup,kaggle
competition,GTSRB - German Traffic Sign Recognition Benchmark,https://www.kaggle.com/datasets/meowmeowmeowmeowmeow/gtsrb-german-traffic-sign,kaggle
competition,Gufhtugu Publications Dataset Challenge,https://www.kaggle.com/datasets/zusmani/gufhtugu-publications-dataset-challenge,kaggle
competition,House Price Prediction Challenge,https://www.kaggle.com/datasets/anmolkumar/house-price-prediction-challenge,kaggle
competition,jigsaw-toxic-comment-classification-challenge,https://www.kaggle.com/datasets/julian3833/jigsaw-toxic-comment-classification-challenge,kaggle
competition,kaggle_writeups For_Competition.pdf,https://www.kaggle.com/datasets/marianadeem755/kaggle-writeupsfor-competition-pdf,kaggle
competition,kaggle_writeups_For_Competition.csv,https://www.kaggle.com/datasets/marianadeem755/kaggle-writeups-for-competition-csv,kaggle
competition,Netflix Prize data,https://www.kaggle.com/datasets/netflix-inc/netflix-prize-data,kaggle
competition,Numenta Anomaly Benchmark (NAB),https://www.kaggle.com/datasets/boltzmannbrain/nab,kaggle
competition,Pokemon- Weedle's Cave,https://www.kaggle.com/datasets/terminus7/pokemon-challenge,kaggle
competition,Restaurant Recommendation Challenge,https://www.kaggle.com/datasets/mrmorj/restaurant-recommendation-challenge,kaggle
competition,Semantic Segmentation for Self Driving Cars,https://www.kaggle.com/datasets/kumaresanmanickavelu/lyft-udacity-challenge,kaggle
competition,Ubiquant Competition Data in Parquet Format,https://www.kaggle.com/datasets/robikscube/ubiquant-parquet,kaggle
competition,UCI ML Drug Review dataset,https://www.kaggle.com/datasets/jessicali9530/kuc-hackathon-winter-2018,kaggle
competition,UNCOVER COVID-19 Challenge,https://www.kaggle.com/datasets/roche-data-science-coalition/uncover,kaggle
environment,(EXPERIMENTAL) NOAA Four Cast Net Global Forecast System (Four Cast NetGFS) (EXPERIMENTAL),https://registry.opendata.aws/noaa-nws-fourcastnetgfs/,aws_open_data
environment,10m Annual Land Use Land Cover (9-class),https://registry.opendata.aws/io-lulc/,aws_open_data
environment,3-Band Cryo Data Wide-field Infrared Survey Explorer (WISE),https://registry.opendata.aws/wise-cryo-3band/,aws_open_data
environment,A Global Drought and Flood Catalogue from 1950 to 2016,https://registry.opendata.aws/global-drought-flood-catalogue/,aws_open_data
environment,"A region-wide, multi-year set of crop field boundary labels for Africa",https://registry.opendata.aws/africa-field-boundary-labels/,aws_open_data
environment,"ABoVE: Bias-Corrected IMERG Monthly Precipitation for Alaska and Canada, 2000-2020",https://registry.opendata.aws/nasa-imergprecipcanadaalaska2097/,aws_open_data
environment,Africa Soil Information Service (AfSIS) Soil Chemistry,https://registry.opendata.aws/afsis/,aws_open_data
environment,AI Weather Prediction (AIWP) Model Reforecasts,https://registry.opendata.aws/aiwp/,aws_open_data
environment,AIRS/Aqua L1B Infrared (IR) geolocated and calibrated radiances V005 (AIRIBRAD) at GES DISC,https://registry.opendata.aws/nasa-airibrad/,aws_open_data
environment,AIRS/Aqua L1C Infrared (IR) resampled and corrected radiances V6.7 (AIRICRAD) at GES DISC,https://registry.opendata.aws/nasa-airicrad/,aws_open_data
environment,All-Sky Data Wide-field Infrared Survey Explorer (WISE),https://registry.opendata.aws/wise-allsky/,aws_open_data
environment,AllWISE Data Wide-field Infrared Survey Explorer (WISE),https://registry.opendata.aws/wise-allwise/,aws_open_data
environment,Amazonia EO satellite on AWS,https://registry.opendata.aws/amazonia/,aws_open_data
environment,Analysis Ready Sentinel-1 Backscatter Imagery,https://registry.opendata.aws/sentinel-1-rtc-indigo/,aws_open_data
environment,ARCO-OCEAN,https://registry.opendata.aws/ogs-arco-ocean/,aws_open_data
environment,ASF SAR Data Products for Disaster Events,https://registry.opendata.aws/asf-event-data/,aws_open_data
environment,ASKAP Radio Telescope,https://registry.opendata.aws/askap/,aws_open_data
environment,ASTER Level 1T Precision Terrain Corrected Registered At-Sensor Radiance V004,https://registry.opendata.aws/nasa-astl1t/,aws_open_data
environment,ATLAS/ICESat-2 L2A Global Geolocated Photon Data V006,https://registry.opendata.aws/nasa-atl03/,aws_open_data
environment,ATLAS/ICESat-2 L3A Land and Vegetation Height V006,https://registry.opendata.aws/nasa-atl08/,aws_open_data
environment,Biodiversity Heritage Library Metadata and Page Images,https://registry.opendata.aws/bhl-open-data/,aws_open_data
environment,Blended TROPOMI+GOSAT Satellite Data Product for Atmospheric Methane,https://registry.opendata.aws/blended-tropomi-gosat-methane/,aws_open_data
environment,Canopy Tree Height Map for the Amazon Forest (mean height composite 2020-2024) by CTrees.org,https://registry.opendata.aws/ctrees-amazon-canopy-height/,aws_open_data
environment,Capella Space Synthetic Aperture Radar (SAR) Open Dataset,https://registry.opendata.aws/capella_opendata/,aws_open_data
environment,CCAFS-Climate Data,https://registry.opendata.aws/cgiardata/,aws_open_data
environment,Central Weather Administration Open Data,https://registry.opendata.aws/cwa_opendata/,aws_open_data
environment,Central Weather Bureau Open Data,https://registry.opendata.aws/cwb_opendata/,aws_open_data
environment,Clay v1.5 Sentinel-2,https://registry.opendata.aws/clay-v1-5-sentinel2/,aws_open_data
environment,Cloud to Street - Microsoft Flood and Clouds Dataset,https://registry.opendata.aws/c2smsfloods/,aws_open_data
environment,Co-Produced Climate Data to Support California's Resilience Investments,https://registry.opendata.aws/caladapt-coproduced-climate-data/,aws_open_data
environment,Community Earth System Model Large Ensemble (CESM LENS),https://registry.opendata.aws/ncar-cesm-lens/,aws_open_data
environment,Community Earth System Model v2 ARISE (CESM2 ARISE),https://registry.opendata.aws/ncar-cesm2-arise/,aws_open_data
environment,Community Earth System Model v2 Large Ensemble (CESM2 LENS),https://registry.opendata.aws/ncar-cesm2-lens/,aws_open_data
environment,Community Multiscale Air Quality (CMAQ) 2019 3D Gridded and Column data from the EPA's Air Quality Time Series (EQUATES) Project,https://registry.opendata.aws/epa-equates-v1/,aws_open_data
environment,Conformational Space of Short Peptides,https://registry.opendata.aws/short_peptides/,aws_open_data
environment,Coupled Model Intercomparison Project Phase 5 (CMIP5) University of Wisconsin-Madison Probabilistic Downscaling Dataset,https://registry.opendata.aws/noaa-uwpd-cmip5/,aws_open_data
environment,Crowdsourced Bathymetry,https://registry.opendata.aws/noaa-dcdb-bathymetry-pds/,aws_open_data
environment,Defense Meteorology Satellite Program (DMSP) Auroral Particle Flux,https://registry.opendata.aws/dmspssj/,aws_open_data
environment,Department of Energy's Geothermal Data Repository (GDR) Data Lake,https://registry.opendata.aws/gdr-data-lake/,aws_open_data
environment,Department of Energy's Marine Energy Data Lake,https://registry.opendata.aws/marine-energy-data/,aws_open_data
environment,Department of Energy's Open Energy Data Initiative (OEDI),https://registry.opendata.aws/oedi-data-lake/,aws_open_data
environment,Digital Earth Africa - Copernicus Global Land Service - Lake Water Quality,https://registry.opendata.aws/deafrica-clgm-lwq/,aws_open_data
environment,"Digital Earth Africa ALOS PALSAR, ALOS-2 PALSAR-2 and JERS-1",https://registry.opendata.aws/deafrica-alos-jers/,aws_open_data
environment,Digital Earth Africa CHIRPS Rainfall,https://registry.opendata.aws/deafrica-chirps/,aws_open_data
environment,Digital Earth Africa Coastlines,https://registry.opendata.aws/deafrica-coastlines/,aws_open_data
environment,Digital Earth Africa Cropland Extent Map (2019),https://registry.opendata.aws/deafrica-crop-extent/,aws_open_data
environment,Digital Earth Africa Fractional Cover,https://registry.opendata.aws/deafrica-fractional-cover/,aws_open_data
environment,Digital Earth Africa GeoMAD,https://registry.opendata.aws/deafrica-geomad/,aws_open_data
environment,Digital Earth Africa Global Mangrove Watch,https://registry.opendata.aws/deafrica-mangrove/,aws_open_data
environment,Digital Earth Africa Landsat Collection 2 Level 2,https://registry.opendata.aws/deafrica-landsat/,aws_open_data
environment,Digital Earth Africa Monthly Normalised Difference Vegetation Index (NDVI) Anomaly,https://registry.opendata.aws/deafrica-ndvi_anomaly/,aws_open_data
environment,Digital Earth Africa Normalised Difference Vegetation Index (NDVI) Climatology,https://registry.opendata.aws/deafrica-ndvi_climatology_ls/,aws_open_data
environment,Digital Earth Africa Sentinel-1 Radiometrically Terrain Corrected,https://registry.opendata.aws/deafrica-sentinel-1/,aws_open_data
environment,Digital Earth Africa Sentinel-2 Level-2A,https://registry.opendata.aws/deafrica-sentinel-2/,aws_open_data
environment,Digital Earth Africa Sentinel-2 Level-2A Surface Reflectance Collection 1,https://registry.opendata.aws/deafrica-sentinel-2-c1/,aws_open_data
environment,Digital Earth Africa Water Observations from Space,https://registry.opendata.aws/deafrica-wofs/,aws_open_data
environment,Digital Earth Pacific Mangroves Extent and Density,https://registry.opendata.aws/dep-mangroves/,aws_open_data
environment,Digital Earth Pacific Water Observatins from Space (WOfS),https://registry.opendata.aws/dep-wofs/,aws_open_data
environment,DOE's Water Power Technology Office's (WPTO) US Wave dataset,https://registry.opendata.aws/wpto-pds-us-wave/,aws_open_data
environment,"Downscaled Climate Data for Alaska (v1.1, August 2023)",https://registry.opendata.aws/wrf-alaska-snap/,aws_open_data
environment,Earth Observation Data Cubes for Brazil,https://registry.opendata.aws/brazil-data-cubes/,aws_open_data
environment,Earth Radio Occultation,https://registry.opendata.aws/gnss-ro-opendata/,aws_open_data
environment,"Ensemble Meteorological Dataset for Planet Earth, EM-Earth",https://registry.opendata.aws/emearth/,aws_open_data
environment,ESA World Cover Sentinel-1 and Sentinel-2 10m Annual Composites,https://registry.opendata.aws/esa-worldcover-vito-composites/,aws_open_data
environment,Finnish Meteorological Institute Weather Radar Data,https://registry.opendata.aws/fmi-radar/,aws_open_data
environment,Galaxy Evolution Explorer Satellite (GALEX),https://registry.opendata.aws/mast-galex/,aws_open_data
environment,GEDI L2A Elevation and Height Metrics Data Global Footprint Level V002,https://registry.opendata.aws/nasa-gedi02a/,aws_open_data
environment,"GEDI L4A Footprint Level Aboveground Biomass Density, Version 2.1",https://registry.opendata.aws/nasa-gedil4aagbdensityv212056/,aws_open_data
environment,"Geosnap Data, Center for Geospatial Sciences",https://registry.opendata.aws/spatial-ucr/,aws_open_data
environment,GHRSST Level 2P Global Sea Surface Skin Temperature from the MODIS on the NASA Terra satellite (GDS2),https://registry.opendata.aws/nasa-modis-t-jpl-l2p-v2019-0/,aws_open_data
environment,GHRSST Level 4 MUR Global Foundation Sea Surface Temperature Analysis (v4.1),https://registry.opendata.aws/nasa-mur-jpl-l4-glob-v41/,aws_open_data
environment,GLAD Landsat ARD,https://registry.opendata.aws/glad-landsat-ard/,aws_open_data
environment,Global Biodiversity Information Facility (GBIF) Species Occurrences,https://registry.opendata.aws/gbif/,aws_open_data
environment,Global Seasonal Sentinel-1 Interferometric Coherence and Backscatter Data Set,https://registry.opendata.aws/ebd-sentinel-1-global-coherence-backscatter/,aws_open_data
environment,Google Satellite Embedding V1,https://registry.opendata.aws/aef-source/,aws_open_data
environment,GPM DPR Precipitation Profile L2A 1.5 hours 5 km V07 (GPM_2ADPR) at GES DISC,https://registry.opendata.aws/nasa-gpm2adpr/,aws_open_data
environment,GPM IMERG Early Precipitation L3 1 day 0.1 degree x 0.1 degree V07 (GPM_3IMERGDE) at GES DISC,https://registry.opendata.aws/nasa-gpm3imergde/,aws_open_data
environment,GPM IMERG Early Precipitation L3 Half Hourly 0.1 degree x 0.1 degree V07 (GPM_3IMERGHHE) at GES DISC,https://registry.opendata.aws/nasa-gpm3imerghhe/,aws_open_data
environment,GPM IMERG Final Precipitation L3 1 day 0.1 degree x 0.1 degree V07 (GPM_3IMERGDF) at GES DISC,https://registry.opendata.aws/nasa-gpm3imergdf/,aws_open_data
environment,GPM IMERG Final Precipitation L3 1 month 0.1 degree x 0.1 degree V07 (GPM_3IMERGM) at GES DISC,https://registry.opendata.aws/nasa-gpm3imergm/,aws_open_data
environment,GPM IMERG Final Precipitation L3 Half Hourly 0.1 degree x 0.1 degree V07 (GPM_3IMERGHH) at GES DISC,https://registry.opendata.aws/nasa-gpm3imerghh/,aws_open_data
environment,GPM IMERG Late Precipitation L3 1 day 0.1 degree x 0.1 degree V07 (GPM_3IMERGDL) at GES DISC,https://registry.opendata.aws/nasa-gpm3imergdl/,aws_open_data
environment,GPM IMERG Late Precipitation L3 Half Hourly 0.1 degree x 0.1 degree V07 (GPM_3IMERGHHL) at GES DISC,https://registry.opendata.aws/nasa-gpm3imerghhl/,aws_open_data
environment,High Resolution Downscaled Climate Data for Southeast Alaska,https://registry.opendata.aws/wrf-se-alaska-snap/,aws_open_data
environment,HIRLAM Weather Model,https://registry.opendata.aws/hirlam/,aws_open_data
environment,HLS Landsat Operational Land Imager Surface Reflectance and TOA Brightness Daily Global 30m v2.0,https://registry.opendata.aws/nasa-hlsl30/,aws_open_data
environment,HLS Sentinel-2 Multi-spectral Instrument Surface Reflectance Daily Global 30m v2.0,https://registry.opendata.aws/nasa-hlss30/,aws_open_data
environment,Hubble Space Telescope,https://registry.opendata.aws/mast-hst/,aws_open_data
environment,HYbrid Coordinate Ocean Model Global Ocean Forecast System Reanalysis,https://registry.opendata.aws/hycom-gofs-3pt1-reanalysis/,aws_open_data
environment,HYCOM-Ocean Track Integrated HYCOM Eulerian Fields and Lagrangian Trajectories Dataset,https://registry.opendata.aws/hycom-global-drifters/,aws_open_data
environment,James Webb Space Telescope (JWST),https://registry.opendata.aws/mast-jwst/,aws_open_data
environment,JAXA /USGS /NASA Kaguya/SELENE Terrain Camera Digital Terrain Models,https://registry.opendata.aws/jaxa-usgs-nasa-kaguya-tc-dtms/,aws_open_data
environment,JAXA /USGS /NASA Kaguya/SELENE Terrain Camera Observations,https://registry.opendata.aws/jaxa-usgs-nasa-kaguya-tc/,aws_open_data
environment,JMA Himawari-8/9,https://registry.opendata.aws/noaa-himawari/,aws_open_data
environment,Korea Meteorological Administration (KMA) GK-2A Satellite Data,https://registry.opendata.aws/noaa-gk2a-pds/,aws_open_data
environment,Land/Sea static mask relevant to IMERG precipitation 0.1x0.1 degree V2 (GPM_IMERG_Land Sea Mask) at GES DISC,https://registry.opendata.aws/nasa-gpmimerglandseamask/,aws_open_data
environment,Landsat Geometric Median and Absolute Deviations (GeoMAD) over the Pacific,https://registry.opendata.aws/dep-ls-geomads/,aws_open_data
environment,LGND Clay v1.5 Sentinel-2,https://registry.opendata.aws/lgnd-clay-v1-5-sentinel2/,aws_open_data
environment,Low Altitude Disaster Imagery (LADI) Dataset,https://registry.opendata.aws/ladi/,aws_open_data
environment,Marine Animal - Satellite Relay Tagging - Quality controlled profiles,https://registry.opendata.aws/aodn_animal_ctd_satellite_relay_tagging_delayed_qc/,aws_open_data
environment,Mars Spectrometry 2: Gas Chromatography for the Sample Analysis at Mars Data (SAM) Instrument,https://registry.opendata.aws/nasa-gcms/,aws_open_data
environment,Mars Spectrometry: Detect Evidence for Past Habitability,https://registry.opendata.aws/nasa-ega/,aws_open_data
environment,"MERRA-2 inst3_3d_aer_Nv: 3d,3-Hourly,Instantaneous,Model-Level,Assimilation,Aerosol Mixing Ratio 0.625 x 0.5 degree",https://registry.opendata.aws/nasa-m2i3nvaer/,aws_open_data
environment,"MERRA-2 inst3_3d_asm_Np: 3d,3-Hourly,Instantaneous,Pressure-Level,Assimilation,Assimilated Meteorological Fields",https://registry.opendata.aws/nasa-m2i3npasm/,aws_open_data
environment,"MERRA-2 inst3_3d_asm_Nv: 3d,3-Hourly,Instantaneous,Model-Level,Assimilation,Assimilated Meteorological Fields 0.625 x 0.5 degree",https://registry.opendata.aws/nasa-m2i3nvasm/,aws_open_data
environment,"MERRA-2 tavg1_2d_slv_Nx: 2d,1-Hourly,Time-Averaged,Single-Level,Assimilation,Single-Level Diagnostics 0.625 x 0.5 degree",https://registry.opendata.aws/nasa-m2t1nxslv/,aws_open_data
environment,Met Office Global Ocean model on a 2-year rolling archive,https://registry.opendata.aws/met-office-global-ocean/,aws_open_data
environment,Met Office NWS Ocean model on a 2-year rolling archive,https://registry.opendata.aws/met-office-nws-ocean/,aws_open_data
environment,Met Office UK Earth System Model (UKESM1) ARISE-SAI geoengineering experiment data,https://registry.opendata.aws/met-office-ukesm1-arise/,aws_open_data
environment,MISR Level 1B2 Ellipsoid Data V004,https://registry.opendata.aws/nasa-mi1b2e/,aws_open_data
environment,MODIS/Aqua Surface Reflectance Daily L2G Global 1km and 500m SIN Grid V061,https://registry.opendata.aws/nasa-myd09ga/,aws_open_data
environment,MODIS/Aqua Surface Reflectance Daily L2G Global 250m SIN Grid V061,https://registry.opendata.aws/nasa-myd09gq/,aws_open_data
environment,MODIS/Terra Calibrated Radiances 5-Min L1B Swath 500m,https://registry.opendata.aws/nasa-mod02hkm/,aws_open_data
environment,MODIS/Terra Net Evapotranspiration 8-Day L4 Global 500m SIN Grid V061,https://registry.opendata.aws/nasa-mod16a2/,aws_open_data
environment,MODIS/Terra Surface Reflectance 8-Day L3 Global 500m SIN Grid V061,https://registry.opendata.aws/nasa-mod09a1/,aws_open_data
environment,MODIS/Terra Surface Reflectance Daily L2G Global 1km and 500m SIN Grid V061,https://registry.opendata.aws/nasa-mod09ga/,aws_open_data
environment,MODIS/Terra Surface Reflectance Daily L2G Global 250m SIN Grid V061,https://registry.opendata.aws/nasa-mod09gq/,aws_open_data
environment,MODIS/Terra Vegetation Indices 16-Day L3 Global 250m SIN Grid V061,https://registry.opendata.aws/nasa-mod13q1/,aws_open_data
environment,MODIS/Terra+Aqua BRDF/Albedo Albedo Daily L3 Global - 500m V061,https://registry.opendata.aws/nasa-mcd43a3/,aws_open_data
environment,MODIS/Terra+Aqua BRDF/Albedo Model Parameters Daily L3 Global - 500m V061,https://registry.opendata.aws/nasa-mcd43a1/,aws_open_data
environment,MODIS/Terra+Aqua BRDF/Albedo Nadir BRDF-Adjusted Ref Daily L3 Global - 500m V061,https://registry.opendata.aws/nasa-mcd43a4/,aws_open_data
environment,Multi-Scale Ultra High Resolution (MUR) Sea Surface Temperature (SST),https://registry.opendata.aws/mur/,aws_open_data
environment,NASA /USGS Controlled Europa DTMs,https://registry.opendata.aws/nasa-usgs-europa-dtms/,aws_open_data
environment,NASA /USGS Controlled THEMIS Mosaics,https://registry.opendata.aws/nasa-usgs-themis-mosaics/,aws_open_data
environment,NASA /USGS Europa Controlled Observation Mosaics,https://registry.opendata.aws/nasa-usgs-europa-mosaics/,aws_open_data
environment,NASA /USGS Europa Controlled Observations,https://registry.opendata.aws/nasa-usgs-europa-observations/,aws_open_data
environment,NASA /USGS Lunar Orbiter Laser Altimeter Cloud Optimized Point Cloud,https://registry.opendata.aws/nasa-usgs-lunar-orbiter-laser-altimeter/,aws_open_data
environment,NASA /USGS Mars Reconnaissance Orbiter (MRO) Context Camera (CTX) Targeted DTMs,https://registry.opendata.aws/nasa-usgs-controlled-mro-ctx-dtms/,aws_open_data
environment,NASA /USGS Released HiRISE Digital Terrain Models,https://registry.opendata.aws/nasa-usgs-mars-hirise-dtms/,aws_open_data
environment,NASA /USGS Uncontrolled HiRISE RDRs,https://registry.opendata.aws/nasa-usgs-mars-hirise/,aws_open_data
environment,NASA Earth Exchange (NEX) Data Collection,https://registry.opendata.aws/nasanex/,aws_open_data
environment,NASA Earth Exchange Global Daily Downscaled Projections (NEX-GDDP-CMIP6),https://registry.opendata.aws/nex-gddp-cmip6/,aws_open_data
environment,NASA High Energy Astrophysics Mission Data,https://registry.opendata.aws/nasa-heasarc/,aws_open_data
environment,NASA Legacy Archive for Microwave Background Data Analysis (LAMBDA),https://registry.opendata.aws/nasa-lambda/,aws_open_data
environment,NASA Physical Sciences Informatics (PSI),https://registry.opendata.aws/nasa-psi/,aws_open_data
environment,NASA Prediction of Worldwide Energy Resources (POWER),https://registry.opendata.aws/nasa-power/,aws_open_data
environment,NASA SOTERIA Simulation Testbed Data,https://registry.opendata.aws/nasa-soteria-data/,aws_open_data
environment,NASA Space Biology Open Science Data Repository (OSDR),https://registry.opendata.aws/nasa-osdr/,aws_open_data
environment,National Climate Database (NCDB),https://registry.opendata.aws/nrel-pds-ncdb/,aws_open_data
environment,Natural Earth,https://registry.opendata.aws/naturalearth/,aws_open_data
environment,NCEP/CPC L3 Half Hourly 4km Global (60S - 60N) Merged IR V1 (GPM_MERGIR) at GES DISC,https://registry.opendata.aws/nasa-gpmmergir/,aws_open_data
environment,NEOWISE Post-Cryo Data Wide-field Infrared Survey Explorer (WISE),https://registry.opendata.aws/wise-postcryo/,aws_open_data
environment,NEOWISE Reactivation Data Near-Earth Object Wide-field Infrared Survey Explorer (NEOWISE),https://registry.opendata.aws/wise-neowiser/,aws_open_data
environment,NEXRAD on AWS,https://registry.opendata.aws/noaa-nexrad/,aws_open_data
environment,Nighttime-Fire-Flare,https://registry.opendata.aws/black_marble_combustion/,aws_open_data
environment,"NOAA - hourly position, current, and sea surface temperature from drifters",https://registry.opendata.aws/noaa-oar-hourly-gdp/,aws_open_data
environment,NOAA /NGA Satellite Computed Bathymetry Assessment-SCuBA,https://registry.opendata.aws/noaa-nos-scuba-icesat2-pds/,aws_open_data
environment,NOAA 3-D Surge and Tide Operational Forecast System for the Atlantic Basin (STOFS-3D-Atlantic),https://registry.opendata.aws/noaa-nos-stofs3d/,aws_open_data
environment,NOAA Analysis of Record for Calibration (AORC) Dataset,https://registry.opendata.aws/noaa-nws-aorc/,aws_open_data
environment,NOAA Atmospheric Climate Data Records,https://registry.opendata.aws/noaa-cdr-atmospheric/,aws_open_data
